{
  "$schema": "http://json-schema.org/draft-07/schema#",
  "title": "LecternModel",
  "type": "array",
  "items": {
    "type": "object",
    "required": [
      "id",
      "brand",
      "model",
      "size",
      "resolution",
      "os",
      "features",
      "warranty",
      "priceRange",
      "image"
    ],
    "properties": {
      "id": {
        "type": "string",
        "description": "Unique ID slug for the model"
      },
      "brand": {
        "type": "string",
        "description": "Brand name"
      },
      "model": {
        "type": "string",
        "description": "Full marketing model name"
      },
      "size": {
        "type": "number",
        "description": "Diagonal screen size in inches"
      },
      "resolution": {
        "type": "string",
        "pattern": "^[0-9]+x[0-9]+$",
        "description": "Screen resolution"
      },
      "os": {
        "type": "string",
        "description": "Operating system or systems supported"
      },
      "features": {
        "type": "array",
        "items": {
          "type": "string"
        },
        "description": "Key marketing features and capabilities"
      },
      "warranty": {
        "type": "string",
        "description": "Warranty period"
      },
      "priceRange": {
        "type": "string",
        "description": "Price range"
      },
      "image": {
        "type": "string",
        "description": "Path to the product image"
      },
      "productURL": {
        "type": "string",
        "format": "uri",
        "description": "URL to the product page or video"
      },
      "motorizedFeatures": {
        "type": "array",
        "items": {
          "type": "string",
          "enum": [
            "height adjustment",
            "screen flip"
          ]
        }
      },
      "audio": {
        "type": "object",
        "properties": {
          "amplifier": {
            "type": "string"
          },
          "speakers": {
            "type": "string"
          }
        }
      },
      "microphone": {
        "type": "object",
        "properties": {
          "type": {
            "type": "string",
            "enum": [
              "gooseneck",
              "wireless",
              "handheld"
            ]
          },
          "quantity": {
            "type": "integer"
          }
        }
      }
    }
  }
}