[{"id": "bslm01","brand": "Focus Digital","model": "SP-Y900-E","size": 21.5,"resolution": "1920x1080","os": "Windows 10","features": ["i5 CPU","16GB DDR RAM","512GB SDD","Mini keyboard","Wireless mobile phone charging","Wireless microphone receiver","9-key shortcut touch panel","Hidden cup holder"],"warranty": "3 years for main structure and 1 year for electronics accessories","priceRange": "1879-1993","image": "","productURL": "https://youtube.com/shorts/u9GfGrk-xZA","motorizedFeatures": ["height adjustment"],"audio": {"amplifier": "260W","speakers": "Built-in"},"microphone": {"type": "gooseneck","quantity": 1}},{"id": "bslm02","brand": "Focus Digital","model": "SP-Y600","size": 21.5,"resolution": "1920x1080","os": "Windows 10","features": ["i5 CPU","16GB DDR RAM","512GB SDD"],"warranty": "3 years for main structure and 1 year for electronics accessories","priceRange": "1670-1786","image": "","productURL": "https://youtube.com/shorts/J3ifzHi_fq","motorizedFeatures": ["height adjustment"],"audio": {"amplifier": "260W","speakers": "Built-in"},"microphone": {"type": "gooseneck","quantity": 1}},{"id": "bslm03","brand": "Focus Digital","model": "FK535K 2.0","size": 23.8,"resolution": "1920x1080","os": "Windows 10","features": ["i5 CPU","8GB DDR RAM","256GB SDD","6-key shortcut touch panel","Silent heavy-duty sliding expandable panel"],"warranty": "3 years for main structure and 1 year for electronics accessories","priceRange": "2025-2139","image": "","productURL": "https://www.youtube.com/shorts/MVzTY2NbolU","motorizedFeatures": ["screen flip"],"audio": {"amplifier": "260W","speakers": "Built-in"},"microphone": {"type": "gooseneck","quantity": 2}},{"id": "bslm06","brand": "Focus Digital","model": "FK500N","size": 21.5,"resolution": "1920x1080","os": "Windows 10","features": ["i5 CPU","8GB DDR RAM","256GB SDD","LED reading lamp"],"warranty": "3 years for main structure and 1 year for electronics accessories","priceRange": "1625-1737","image": "","productURL": "https://www.youtube.com/shorts/ZYjwSKZp_HO","motorizedFeatures": ["screen flip"],"audio": {"amplifier": "260W","speakers": "Built-in"},"microphone": {"type": "gooseneck","quantity": 1}},{"id": "bslm09","brand": "Focus Digital","model": "S800SN","size": 21.5,"resolution": "1920x1080","os": "Windows 10","features": ["i5 CPU","8GB DDR RAM","256GB SDD","8MP document scanner","Electric lock system","10U cabinet"],"warranty": "3 years for main structure and 1 year for electronics accessories","priceRange": "1625-1737","image": "","productURL": "https://youtu.be/8cnBuO5jRB4","motorizedFeatures": ["screen flip"],"audio": {"amplifier": "250W","speakers": "Built-in"},"microphone": {"type": "gooseneck","quantity": 1}},{"id": "bslm10","brand": "Focus Digital","model": "S700","size": 21.5,"resolution": "1920x1080","os": "Windows 10","features": ["i5 CPU","8GB DDR RAM","256GB SDD","Cooling fan","10U cabinet","Sliding cover"],"warranty": "3 years for main structure and 1 year for electronics accessories","priceRange": "1625-1737","image": "","productURL": "https://youtu.be/uvgbAfBzJNg","motorizedFeatures": ["screen flip"],"audio": {"amplifier": "250W","speakers": "Built-in"},"microphone": {"type": "gooseneck","quantity": 1}},{"id": "bslm04","brand": "Focus Digital","model": "ST100","size": 23.8,"resolution": "1920x1080","os": "Windows 10","features": ["i5 CPU","16GB DDR RAM","512GB SDD","18.5\" smart kiosk front display","6-key multi-functional shortcut key panel","Magnetic timer","Keyboard drawer","Cup holder"],"warranty": "3 years for main structure and 1 year for electronics accessories","priceRange": "3375-3490","image": "","productURL": "https://youtube.com/shorts/gls23VGYYGI","motorizedFeatures": ["height adjustment"],"microphone": {"type": "gooseneck","quantity": 2}},{"id": "bslm05","brand": "Focus Digital","model": "FK530T 2.0","size": 23.6,"resolution": "1920x1080","os": "Windows 10","features": ["i5 CPU","8GB DDR RAM","256GB SDD","Dual 4U cabinet"],"warranty": "3 years for main structure and 1 year for electronics accessories","priceRange": "1750-1868","image": "","productURL": "https://youtu.be/9R_jLc5-SuY?si=P62oiWviHBmb6Lz8","motorizedFeatures": ["height adjustment"],"microphone": {"type": "gooseneck","quantity": 2}},{"id": "bslm07","brand": "Focus Digital","model": "ST200","size": 21.5,"resolution": "1920x1080","os": "Windows 10","features": ["i5 CPU","16GB DDR RAM","512GB SDD","1x storage drawer","6-key shortcut touch panel","Magnetic timer","Mini keyboard","Wireless charger for mobile phone","Cup holder"],"warranty": "3 years for main structure and 1 year for electronics accessories","priceRange": "3636-3745","image": "","productURL": "https://youtube.com/shorts/306a1yn_wao","motorizedFeatures": ["height adjustment"],"microphone": {"type": "gooseneck","quantity": 2}},{"id": "bslm14","brand": "Focus Digital","model": "SP-Y670","size": 21.5,"resolution": "1920x1080","os": "Windows 10","features": ["i5 CPU","16GB DDR RAM","512GB SDD","Mini keyboard","Wireless charger for mobile phone","Cup holder"],"warranty": "3 years for main structure and 1 year for electronics accessories","priceRange": "2110-2211","image": "","productURL": "https://youtu.be/1zjYkl_UoGM","motorizedFeatures": ["height adjustment"],"microphone": {"type": "gooseneck","quantity": 1}},{"id": "bslm08","brand": "Focus Digital","model": "FK500V","size": 21.5,"resolution": "1920x1080","os": "Windows 10","features": ["i5 CPU","8GB DDR RAM","256GB SDD","Keyboard drawer","Folding mouse tray"],"warranty": "3 years for main structure and 1 year for electronics accessories","priceRange": "1525-1628","image": "","productURL": "https://youtube.com/shorts/ZEPcmxlZCWo","motorizedFeatures": ["screen flip"],"microphone": {"type": "gooseneck","quantity": 2}},{"id": "bslm11","brand": "Focus Digital","model": "FK535K-D","size": 21.5,"resolution": "1920x1080","os": "Windows 10","features": ["i5 CPU","8GB DDR RAM","256GB SDD","Keyboard drawer","Sliding cover","32\" front display"],"warranty": "3 years for main structure and 1 year for electronics accessories","priceRange": "2263-2388","image": "","productURL": "https://youtube.com/shorts/tqDESfLmYM","motorizedFeatures": ["screen flip"],"microphone": {"type": "gooseneck","quantity": 1}},{"id": "bslm15","brand": "Focus Digital","model": "FK535K 1.0","size": 21.5,"resolution": "1920x1080","os": "Windows 10","features": ["i5 CPU","8GB DDR RAM","256GB SDD","Keyboard drawer","Sliding cover"],"warranty": "3 years for main structure and 1 year for electronics accessories","priceRange": "1746-1880","image": "","productURL": "https://youtu.be/ejwfyRjcvNM","motorizedFeatures": ["screen flip"],"microphone": {"type": "gooseneck","quantity": 1}}]
