[
  {
    "id": "maxhub-sl22mc",
    "brand": "MAXHUB",
    "model": "SL22MC",
    "size": 21.5,
    "resolution": "1920x1080",
    "os": "Windows 10 IoT Enterprise",
    "features": [
      "i5-1240P CPU",
      "16GB RAM",
      "256GB ROM",
      "Full Lamination Technology",
      "Active Capacitive Touch Technology",
      "Wireless Screen Sharing",
      "Wi-Fi Dual-band 2.4G/5G",
      "Easy to Move",
      "Highly Intergrated",
      "Multiple Audio Output Interfaces"
    ],
    "warranty": "3 years",
    "priceRange": "",
    "image": "",
    "productURL": "https://www.maxhub.com/en/sl22mc",
    "motorizedFeatures": [
      "height adjustment"
    ],
    "microphone": {
      "type": "gooseneck",
      "quantity": 2
    }
  }
]